{
  "$schema": "http://json-schema.org/draft-07/schema#",
  "$id": "https://klartex.se/schemas/resultatrakning/v0.1",
  "title": "Resultaträkning",
  "description": "Income statement with comparison years and optional notes",
  "type": "object",
  "required": ["title", "period", "rubrik_ar1", "rubrik_ar2", "grupper"],
  "additionalProperties": false,
  "properties": {
    "page_template": {
      "$comment": "Generated at load time from the slot model in klartex/page_templates.py (page_template_schema); see registry.py."
    },
    "title": {
      "type": "string",
      "description": "Document title (e.g. 'Resultaträkning')"
    },
    "period": {
      "type": "string",
      "description": "Accounting period (e.g. '2025-01-01 -- 2025-12-31')"
    },
    "rubrik_ar1": {
      "type": "string",
      "description": "Column header for year 1 (e.g. '2025')"
    },
    "rubrik_ar2": {
      "type": "string",
      "description": "Column header for year 2 (e.g. '2024')"
    },
    "grupper": {
      "type": "array",
      "description": "Financial groups with rows and subtotals",
      "items": {
        "type": "object",
        "required": ["rubrik", "poster", "summa"],
        "additionalProperties": false,
        "properties": {
          "rubrik": { "type": "string" },
          "poster": {
            "type": "array",
            "items": {
              "type": "object",
              "required": ["post", "belopp_ar1", "belopp_ar2"],
              "additionalProperties": false,
              "properties": {
                "post": { "type": "string" },
                "belopp_ar1": { "type": "number" },
                "belopp_ar2": { "type": "number" },
                "notref": { "type": "integer" }
              }
            },
            "minItems": 1
          },
          "summa": {
            "type": "object",
            "required": ["label", "belopp_ar1", "belopp_ar2"],
            "additionalProperties": false,
            "properties": {
              "label": { "type": "string" },
              "belopp_ar1": { "type": "number" },
              "belopp_ar2": { "type": "number" }
            }
          }
        }
      },
      "minItems": 1
    },
    "resultat": {
      "type": "object",
      "description": "Final result row",
      "required": ["label", "belopp_ar1", "belopp_ar2"],
      "additionalProperties": false,
      "properties": {
        "label": { "type": "string" },
        "belopp_ar1": { "type": "number" },
        "belopp_ar2": { "type": "number" }
      }
    },
    "noter": {
      "type": "array",
      "description": "Optional numbered notes",
      "items": {
        "type": "object",
        "required": ["notnr", "text"],
        "additionalProperties": false,
        "properties": {
          "notnr": { "type": "integer" },
          "text": { "type": "string" }
        }
      },
      "minItems": 1
    }
  }
}
